{
  "schema": "fsusui-design-conformance.ux-acceptance-receipt.v2",
  "classificationReceiptDigest": "a025b0aaa888044f70c82a039eeeb813f0ac804dba1429106fffd2c24ffe0c00",
  "candidateSha": "810fe29ed7eb82ff2f700ac700c16c7243d17403",
  "candidateDigest": "ce4b073e47878c49bbcaba4270be707788fa625ca9fbfc43b476111b2cb14adc",
  "verificationClass": "ux-path",
  "requiredSkillDigests": [
    "c88357a6ba0340000bae5839daeb67a3cd2722e8242cf7e0148006c3610a44fe"
  ],
  "authorityDigests": [
    "a4a29ee47820b7e13f9ddbce653703c3afba9b30cdc0fec02b498d633184ae14",
    "24c88676101dde43bb0907ed173f001b6e1659973caf19701ea57eddf0617039",
    "892896b49b21c1f37667ebec8ac7bce08c94e15f53942e0e0b10d1e8b7edb3a5",
    "96a293a38282e63f67976b97b4ecfbd2802ae28812735a6259d25940d56bdc84",
    "22b63749bd3ed35a4f8c174f4b8b026033bd2d645ffa39e335ba5b30489142b4",
    "21d1319e8f5fad2c0c541b9c78ce2cb88b87c6dd40552b2d17a846128afcd506",
    "f1cbea9be45f2439dfe7578f176ec3845c6d491294c7cd7a2e6d3665a818fe7c",
    "735e34e305b5bb6ae473bb8e6d33bb7eb615d111c25e710361d2fc463230a227",
    "e877dee20be5dfd2aa1c1da8127f432488c6ad0812dfe555173d1ff7eb6ce1e2",
    "1dc525d0cfefcd47530730b826a7f590565fde6cc349c3798ebe3812d89a1359"
  ],
  "activeBaselineIdentityDigest": "993e02246ae968cf22f04511e682d9c57b2c73cf5e1b958c0aa58ad6361b5909",
  "domainPolicyDigest": "620c4f746c1f259e3b640044975ad2878b7913806038706f7991bee9d72104d3",
  "independenceEvidenceDigest": "2d1a6210eec68aea8c5aabbed974843e76c1399e15ad423dfbdeaa334cc49c94",
  "modifiedPaths": [],
  "productionFixture": true,
  "viewportStateMatrix": [
    {
      "viewport": "avalonia-real-top-level-960x720-96dpi",
      "state": "markdown transaction after undo with keyboard focus",
      "theme": "light",
      "inputModes": ["keyboard"],
      "evidenceDigest": "0a3354587d410610f0a0232195817753af1d624e8c6de5c99ce397f40e693ad6"
    },
    {
      "viewport": "avalonia-headless-680x360-96dpi",
      "state": "single-owner live projection and current-range emphasis",
      "theme": "light",
      "inputModes": ["keyboard", "reduced-motion"],
      "evidenceDigest": "6742bc25315464c88c08449c6883e5f4ec3372a90fdceb040a8f363751114ca5"
    },
    {
      "viewport": "avalonia-headless-680x360-96dpi",
      "state": "single-owner live projection and current-range emphasis",
      "theme": "dark",
      "inputModes": ["keyboard", "reduced-motion"],
      "evidenceDigest": "306eb8989cb18ac6ceb0f57a74d50d587ec3687521e077d2f13b6771ecfc56bc"
    },
    {
      "viewport": "linux-xwayland-native-720x380-2x-dpi-scrolled",
      "state": "real ibus composition commit cancel undo stale reject clipboard Unicode and candidate caret",
      "theme": "light",
      "inputModes": ["keyboard"],
      "evidenceDigest": "c510e8b28069c130cedb0a08bf260728e46d7e6e0e65629e78724789ea96cca6"
    }
  ],
  "inspectedRenderedArtifacts": [
    {
      "id": "markdown-editor-real-top-level",
      "kind": "screenshot",
      "path": "tests/conformance/visual/artifacts/issue-341-rendered/avalonia.png",
      "digest": "0a3354587d410610f0a0232195817753af1d624e8c6de5c99ce397f40e693ad6",
      "inspected": true,
      "fixtureClass": "production"
    },
    {
      "id": "markdown-editor-adjacent-light",
      "kind": "screenshot",
      "path": "tests/conformance/visual/artifacts/issue-341-rendered/issue-717-markdown-editor-adjacent/markdown-editor-adjacent-light.png",
      "digest": "6742bc25315464c88c08449c6883e5f4ec3372a90fdceb040a8f363751114ca5",
      "inspected": true,
      "fixtureClass": "production"
    },
    {
      "id": "markdown-editor-adjacent-dark",
      "kind": "screenshot",
      "path": "tests/conformance/visual/artifacts/issue-341-rendered/issue-717-markdown-editor-adjacent/markdown-editor-adjacent-dark.png",
      "digest": "306eb8989cb18ac6ceb0f57a74d50d587ec3687521e077d2f13b6771ecfc56bc",
      "inspected": true,
      "fixtureClass": "production"
    },
    {
      "id": "linux-native-ime-trace",
      "kind": "trace",
      "path": "tests/conformance/visual/artifacts/issue-341-linux-ime-evidence.json",
      "digest": "c510e8b28069c130cedb0a08bf260728e46d7e6e0e65629e78724789ea96cca6",
      "inspected": true,
      "fixtureClass": "production"
    }
  ],
  "blockers": [],
  "status": "accepted",
  "receiptDigest": "9821bf5dbdc5ce6490876bd59f9d2121fb8de35fcf1222842fbde37e3d2ca2b8"
}
