{
  "schema": "fsusui-design-conformance.ux-acceptance-receipt.v2",
  "classificationReceiptDigest": "11c59544f7992df4325e01b6c9ad6aad21cacbf91b918312a276508b81a92a53",
  "candidateSha": "4cba6e9ca424cdb6d606ed9df34983996319f4fd",
  "candidateDigest": "3d454fe0091954be01bdd6d8cfde1db9f13cdef078a50dd19a09b2ff25701cbd",
  "verificationClass": "ux-path",
  "requiredSkillDigests": [
    "c88357a6ba0340000bae5839daeb67a3cd2722e8242cf7e0148006c3610a44fe"
  ],
  "authorityDigests": [
    "24c88676101dde43bb0907ed173f001b6e1659973caf19701ea57eddf0617039",
    "892896b49b21c1f37667ebec8ac7bce08c94e15f53942e0e0b10d1e8b7edb3a5",
    "96a293a38282e63f67976b97b4ecfbd2802ae28812735a6259d25940d56bdc84",
    "22b63749bd3ed35a4f8c174f4b8b026033bd2d645ffa39e335ba5b30489142b4",
    "069c6efa2e44f775544bb037cd550a0edbdd8ca98a4e40bfc473f6a1bb0d9f74",
    "f7fc02309cd684891081e2ae727378827f4fd7cd7b5f508a5302b97e6b5412df",
    "fb789c0afd4f9df9c94d52dbd998dc2fb7bc2c2306d68df2e36d1eb848e0e159",
    "f149631813fbfb060d49412329638555e0f0c371fb441cf89ab46cd64a3e3de6"
  ],
  "activeBaselineIdentityDigest": "116bd1514d3035b7ae5d11886c53110c62e91ed67dfb290bcf171758c9bd52b8",
  "domainPolicyDigest": "620c4f746c1f259e3b640044975ad2878b7913806038706f7991bee9d72104d3",
  "independenceEvidenceDigest": "63cd1f77ac10169883459d7302e15740139d5bbb6a6f793fc1313ce4996674cc",
  "modifiedPaths": [],
  "productionFixture": true,
  "viewportStateMatrix": [
    {
      "viewport": "avalonia-headless-640x680-96dpi",
      "state": "default-wheel-zoomed-drag-panned-source-reset-viewport-clipped",
      "theme": "light",
      "inputModes": ["pointer", "keyboard"],
      "evidenceDigest": "8ac22e2e83107d5d865393803e91307a3c0c37e015727dc2bdcdcd9897e89c12"
    },
    {
      "viewport": "avalonia-headless-960x1020-144dpi",
      "state": "default-wheel-zoomed-drag-panned-source-reset-viewport-clipped",
      "theme": "light",
      "inputModes": ["pointer", "keyboard"],
      "evidenceDigest": "7e68260cc4f8c31a6e67f83f8ce0ae12573496eb25180240fd97ce40b0c3aa35"
    },
    {
      "viewport": "avalonia-headless-640x680-96dpi",
      "state": "default-wheel-zoomed-drag-panned-source-reset-viewport-clipped",
      "theme": "dark",
      "inputModes": ["pointer", "keyboard"],
      "evidenceDigest": "912b72dafe819422e55b72418a29424786c084d6710b1be42cd0893f69913ba1"
    },
    {
      "viewport": "avalonia-headless-960x1020-144dpi",
      "state": "default-wheel-zoomed-drag-panned-source-reset-viewport-clipped",
      "theme": "dark",
      "inputModes": ["pointer", "keyboard"],
      "evidenceDigest": "5a5f24e7907b9578d35c4086b3d1065c2563de014546f7ea715ea2a10f7f3d86"
    },
    {
      "viewport": "local-headless-automation",
      "state": "image-name-zoom-pan-source-reset-status",
      "theme": "light",
      "inputModes": ["pointer", "keyboard"],
      "evidenceDigest": "b046847cd34c5bb09357004bd1d8c5e542d883c297ae759553ed9c2c56ea7975"
    }
  ],
  "inspectedRenderedArtifacts": [
    {
      "id": "image-viewer-light-96dpi-state-matrix",
      "kind": "screenshot",
      "path": "dotnet/FsusUI.Avalonia.HeadlessTests/TestResults/visual-evidence/issue-699-image-viewer-render/issue-699-image-viewer-light-96dpi.png",
      "digest": "8ac22e2e83107d5d865393803e91307a3c0c37e015727dc2bdcdcd9897e89c12",
      "inspected": true,
      "fixtureClass": "production"
    },
    {
      "id": "image-viewer-light-144dpi-state-matrix",
      "kind": "screenshot",
      "path": "dotnet/FsusUI.Avalonia.HeadlessTests/TestResults/visual-evidence/issue-699-image-viewer-render/issue-699-image-viewer-light-144dpi.png",
      "digest": "7e68260cc4f8c31a6e67f83f8ce0ae12573496eb25180240fd97ce40b0c3aa35",
      "inspected": true,
      "fixtureClass": "production"
    },
    {
      "id": "image-viewer-dark-96dpi-state-matrix",
      "kind": "screenshot",
      "path": "dotnet/FsusUI.Avalonia.HeadlessTests/TestResults/visual-evidence/issue-699-image-viewer-render/issue-699-image-viewer-dark-96dpi.png",
      "digest": "912b72dafe819422e55b72418a29424786c084d6710b1be42cd0893f69913ba1",
      "inspected": true,
      "fixtureClass": "production"
    },
    {
      "id": "image-viewer-dark-144dpi-state-matrix",
      "kind": "screenshot",
      "path": "dotnet/FsusUI.Avalonia.HeadlessTests/TestResults/visual-evidence/issue-699-image-viewer-render/issue-699-image-viewer-dark-144dpi.png",
      "digest": "5a5f24e7907b9578d35c4086b3d1065c2563de014546f7ea715ea2a10f7f3d86",
      "inspected": true,
      "fixtureClass": "production"
    },
    {
      "id": "image-viewer-local-headless-automation",
      "kind": "accessibility-tree",
      "path": "tests/conformance/visual/artifacts/issue-699-avalonia-image-viewer-automation-report.json",
      "digest": "b046847cd34c5bb09357004bd1d8c5e542d883c297ae759553ed9c2c56ea7975",
      "inspected": true,
      "fixtureClass": "production"
    }
  ],
  "blockers": [],
  "status": "accepted",
  "receiptDigest": "3989056ba4f07a30a1e9e54127884f7b787a12330e8829d6dc3c8bd2a342157a"
}
