{
  "schema": "fsusui-design-conformance.ux-acceptance-receipt.v2",
  "classificationReceiptDigest": "2265a2542aaca4dc5194d9aa574d6785923cc7681ccba7c8af4b0dba9fa718de",
  "candidateSha": "c5735d781714a5e7d5fa1a20aacec138d975649e",
  "candidateDigest": "ebac6f17237e8be2c3cb2edfe0d99eda79823d27a4437b937094bba2e140e0f4",
  "verificationClass": "ux-path",
  "requiredSkillDigests": [
    "c88357a6ba0340000bae5839daeb67a3cd2722e8242cf7e0148006c3610a44fe"
  ],
  "authorityDigests": [
    "24c88676101dde43bb0907ed173f001b6e1659973caf19701ea57eddf0617039",
    "892896b49b21c1f37667ebec8ac7bce08c94e15f53942e0e0b10d1e8b7edb3a5",
    "96a293a38282e63f67976b97b4ecfbd2802ae28812735a6259d25940d56bdc84",
    "22b63749bd3ed35a4f8c174f4b8b026033bd2d645ffa39e335ba5b30489142b4",
    "e877dee20be5dfd2aa1c1da8127f432488c6ad0812dfe555173d1ff7eb6ce1e2",
    "781865ee52aaf6dce0020615a387caa24512dcd55fb45a73afebb9377d03f091"
  ],
  "activeBaselineIdentityDigest": "ecd166c0627407b28670486a1c535b6764fa02fde4876aa603b55eec4bbe38bd",
  "domainPolicyDigest": "620c4f746c1f259e3b640044975ad2878b7913806038706f7991bee9d72104d3",
  "independenceEvidenceDigest": "d77ce7e73a8d370fcb6d480a76bed24c7eb13c0fe4ce4c9a2153b12e46ed8989",
  "modifiedPaths": [],
  "productionFixture": true,
  "viewportStateMatrix": [
    {
      "viewport": "1440x1000@100%",
      "state": "long-warnings-actions-focus-and-accessibility-tree",
      "theme": "light",
      "inputModes": ["keyboard", "screen-reader", "zoom"],
      "evidenceDigest": "acc95344ed2d05ced1531062c76ccd9e0860f88618c75934b2271c349bce24c3"
    },
    {
      "viewport": "1440x1000@150%",
      "state": "long-warnings-actions-focus-and-accessibility-tree",
      "theme": "dark",
      "inputModes": ["keyboard", "screen-reader", "zoom"],
      "evidenceDigest": "849590403311b68753ca4e052420d33227ff3a47ba42c2e48ddbc75101f7fdbe"
    },
    {
      "viewport": "375x812@100%",
      "state": "long-warnings-stacked-actions-focus-and-touch-path",
      "theme": "light",
      "inputModes": ["keyboard", "touch", "screen-reader", "zoom"],
      "evidenceDigest": "8dbb5a307b07f9e2b049ec5758ee62e722608aeb913b9be838198e33ec883de9"
    },
    {
      "viewport": "375x812@200%",
      "state": "long-warnings-stacked-actions-focus-and-touch-path",
      "theme": "dark",
      "inputModes": ["keyboard", "touch", "screen-reader", "zoom"],
      "evidenceDigest": "86865977623d95ddc73a6bd6089c167e7e376d888dab367c369907f49af9b5fe"
    }
  ],
  "inspectedRenderedArtifacts": [
    {
      "id": "desktop-light-100",
      "kind": "screenshot",
      "path": "tests/conformance/visual/artifacts/screenshots/web/issue-395-markdown-import/desktop-light-100.png",
      "digest": "acc95344ed2d05ced1531062c76ccd9e0860f88618c75934b2271c349bce24c3",
      "inspected": true,
      "fixtureClass": "production"
    },
    {
      "id": "desktop-dark-150",
      "kind": "screenshot",
      "path": "tests/conformance/visual/artifacts/screenshots/web/issue-395-markdown-import/desktop-dark-150.png",
      "digest": "849590403311b68753ca4e052420d33227ff3a47ba42c2e48ddbc75101f7fdbe",
      "inspected": true,
      "fixtureClass": "production"
    },
    {
      "id": "mobile-light-100",
      "kind": "screenshot",
      "path": "tests/conformance/visual/artifacts/screenshots/web/issue-395-markdown-import/mobile-light-100.png",
      "digest": "8dbb5a307b07f9e2b049ec5758ee62e722608aeb913b9be838198e33ec883de9",
      "inspected": true,
      "fixtureClass": "production"
    },
    {
      "id": "mobile-dark-200",
      "kind": "screenshot",
      "path": "tests/conformance/visual/artifacts/screenshots/web/issue-395-markdown-import/mobile-dark-200.png",
      "digest": "86865977623d95ddc73a6bd6089c167e7e376d888dab367c369907f49af9b5fe",
      "inspected": true,
      "fixtureClass": "production"
    },
    {
      "id": "dialog-accessibility-tree",
      "kind": "accessibility-tree",
      "path": "tests/conformance/visual/artifacts/screenshots/web/issue-395-markdown-import/accessibility-evidence.json",
      "digest": "158dc44d72d1f0e8b9b13ddb7ffaf851b376757b006eedf755b24167b099a1dc",
      "inspected": true,
      "fixtureClass": "production"
    }
  ],
  "blockers": [],
  "status": "accepted",
  "receiptDigest": "9c2033a1d5f1e512d972ef51fa0b0b8d217bccc8d14f5eec6b557b933de76ad6"
}
